count,date,title,description,org_link,link
251,2024-08-13 13:14:00,[#증권톡톡] 신한투자증권 매머드커피와 음료 콜라보·한국투자증권 한부모 가...,이번 행사에서는 '마스터스 아카데미' 출범을 기념해 권영우 한국<b>인공지능</b>협회 부회장이 '챗GPT를 활용한 기업 경영계획 수립 및 산업 분석'을 주제로 세미나를 실시한다. 또 지난해 2월부터 진행된 '금융&amp;아트 세미나... ,https://www.newsworks.co.kr/news/articleView.html?idxno=762269,https://www.newsworks.co.kr/news/articleView.html?idxno=762269
252,2024-08-13 13:14:00,"큐리오시스, 디지털 병리 시스템 ‘MSP 320’ 레드닷 어워드 ‘Best of Best’...","이 장비는 암 진단 과정에 필수적인 조직 슬라이드를 고해상도로 신속하게 자동 촬영하는 것은 물론, <b>인공지능</b>(AI) 기반의 진단을 통해 국내 디지털 병리학의 발전에 중추적인 역할을 하고 있다. 지난해 3월... ",http://www.segyebiz.com/newsView/20240813511921?OutUrl=naver,http://www.segyebiz.com/newsView/20240813511921?OutUrl=naver
253,2024-08-13 13:14:00,"KT, 경북지역 중소기업의 디지털전환으로 기업경영애로 해소 나서","이에, KT는 중소기업중앙회와의 긴밀한 협력을 통해 기업 경쟁력 확보에 필수인 에너지 솔루션 공급과 AICT(<b>인공지능</b>+통신기술) 기반 디지털 전환을 적극 지원한다는 방침이다. 특히 자율주행 AI 로봇으로 물류 자동화... ",https://www.wikitree.co.kr/articles/975066,https://www.wikitree.co.kr/articles/975066
254,2024-08-13 13:14:00,하이브리드 AI 시대…&quot;아마존 베드록으로 똑똑하게 골라 쓴다&quot;,아마존웹서비스(AWS)의 생성형 <b>인공지능</b>(AI) 플랫폼 '아마존 베드록'이 한 단계 진화했다. 실행 능력과 안전성을 강화해 기업용 AI 시장 공략에 속도를 낸다. AWS코리아는 13일 역삼동 센터필드 이스트에서 'AWS 2024... ,https://view.asiae.co.kr/article/2024081313145498515,https://n.news.naver.com/mnews/article/277/0005458581?sid=105
255,2024-08-13 13:14:00,김성태 행장 &quot;문화예술 통한 사회공헌사업에 앞장설 것&quot;,출력된 이미지는 <b>인공지능</b>이 학습해 만들어낸 가상의 이미지로 SNS 매체에 포스팅된 게시물의 텍스트나 픽셀을 상호 모방해 이미지를 변형한 결과물이다. 김성태 행장은 &quot;IBK 아트 스테이션 2024를 통해 역량 있는... ,http://www.issuenbiz.com/news/articleView.html?idxno=47444,http://www.issuenbiz.com/news/articleView.html?idxno=47444
256,2024-08-13 13:12:00,무더위에 전력 총수요 102GW… 역대 최고치 경신,"제11차 전력수급기본계획(전기본) 총괄위원회는 지난 5월 공개한 11차 전기본 초안을 통해 <b>인공지능</b>(AI) 확산, 반도체 클러스터 조성 등으로 2038년까지 16.7GW의 전력수요 추가 요인이 있을 것으로 예측했다. /김민솔... ",https://www.asiatime.co.kr/article/20240813500214,https://www.asiatime.co.kr/article/20240813500214
257,2024-08-13 13:12:00,"하나은행-KAIST, 금융권 최초 'AI 상업용 부동산 시장예측 모델' 개발",#하나은행 #하나 AI CRP #부동산 시장 예측 하나은행 부동산 투자자문팀은 한국과학기술원(KAIST) 김우창 교수 연구팀과 <b>인공지능</b>(AI) 기술을 기반으로 한 상업용 부동산 시장 예측 모델인 '하나 AI CRP' 서비스를... ,http://www.techholic.co.kr/news/articleView.html?idxno=213594,http://www.techholic.co.kr/news/articleView.html?idxno=213594
258,2024-08-13 13:12:00,"카카오엔터프라이즈 &quot;AICC 센터플로우, 스타트업 성장 견인&quot;","카카오엔터프라이즈가 카카오클라우드 기반의 AICC(<b>인공지능</b> 컨택센터) 센터플로우를 이용하는 브랜드 가구, 건축자재, 스크린골프 플랫폼 등 다양한 스타트업들의 비즈니스 성장 견인에 AI·클라우드 기술로 기여하고... ",http://www.seoulfn.com/news/articleView.html?idxno=529360,http://www.seoulfn.com/news/articleView.html?idxno=529360
259,2024-08-13 13:12:00,"샌즈랩-로그프레소, 미래 사이버 보안 시장 위한 차세대 AI 기반 XDR 개발",기자] <b>인공지능</b>(AI) 기반 사이버 위협 인텔리전스(CTI) 전문기업 샌즈랩(대표 김기홍)은 지난 8일 클라우드 SIEM 전문기업 로그프레소와 ‘<b>인공지능</b> 기반 차세대 XDR(Extended Detection and Response) 개발을 위한 업무 협약’을... ,http://www.boannews.com/media/view.asp?idx=132006&kind=,http://www.boannews.com/media/view.asp?idx=132006&kind=
260,2024-08-13 13:11:00,'2024년 DMC 빅데이터 아이디어 오디션' 성료,"DBI2024은 빅데이터/<b>인공지능</b>/로봇 분야의 주제로 참가 자격에 제한 없이 모집했다. 서류 심사 후 본선에 총 10개팀이 선정됐으며, 5개 팀이 최종 선정됐다. 최종발표에서 아이디어의 독창성 및 사업화 가능성여부... ",https://www.etnews.com/20240813000170,https://n.news.naver.com/mnews/article/030/0003231299?sid=101
261,2024-08-13 13:10:00,"한화운용, '한·미·일' 3개국 공략 PLUS ETF 출시","'PLUS글로벌AI인프라'는 <b>인공지능</b>(AI) 인프라의 기반이 되는 그래픽처리장치(GPU)·AI가속기를 제조하는 엔비디아에 25%를 투자하며, AI데이터센터에 사용되는 'AI서버&amp;네트워크', '전력인프라', '냉각 시스템'에... ",https://www.newsway.co.kr/news/view?ud=2024081311563681450,https://www.newsway.co.kr/news/view?ud=2024081311563681450
262,2024-08-13 13:10:00,"대구가톨릭대, 고교생 대상 미래 모빌리티 썸머캠프 개최","RIS 모비릴티디지털전환사업단은 전문 인재 양성과 기술 고도화를 목표로 △기계, <b>인공지능</b>-소프트웨어, 전자, 디자인 분야의 융합 교육 △개방형 메타버스 기반 모빌리티 교육시스템 구축 △지역 기업 및 연구기관과... ",https://www.kbmaeil.com/news/articleView.html?idxno=1007451,https://www.kbmaeil.com/news/articleView.html?idxno=1007451
263,2024-08-13 13:10:00,"S2W, ‘금융 보안 TF’ 출범한다... “금융업 특화 AI-보안 전문팀 발족”",기술과 <b>인공지능</b>을 기반으로 한 ‘금융업계 특화 전문 TF’가 출범한다. AI 및 보안 전문 데이터 인텔리전스 기업 S2W(대표 서상덕)는 금융 시장에서 필요로 하는 보안 솔루션 개발 및 데이터 위협 감지에 최적화된 금융... ,http://www.boannews.com/media/view.asp?idx=132005&kind=,http://www.boannews.com/media/view.asp?idx=132005&kind=
264,2024-08-13 13:10:00,"KT, 경북지역 중소기업 디지털전환 지원",협약에 따라 양 기관은 경북지역 중소기업의 성장발전을 위해  중소기업중앙회 지원사업 활성화  디지털 전환 인프라 지원  <b>인공지능</b>(AI)을 활용한 물류 자동화 환경 조성  운영 비용 절감을 통한 수익성 향상 등에... ,http://www.koit.co.kr/news/articleView.html?idxno=124618,http://www.koit.co.kr/news/articleView.html?idxno=124618
265,2024-08-13 13:10:00,"경기도, <b>인공지능</b> 활용 성평등 캠페인 영상 제작","경기도는 출생률 저하와 결혼 및 출산 기피 문제에 대응하기 위해 결혼, 출산, 양육을 주제로 한 성평등 캠페인 영상을 <b>인공지능</b>(AI) 기술로 제작해 배포한다고 13일 밝혔다. 생성형 <b>인공지능</b> 프로그램을 통해 만든... ",http://www.shinailbo.co.kr/news/articleView.html?idxno=1916895,http://www.shinailbo.co.kr/news/articleView.html?idxno=1916895
266,2024-08-13 13:10:00,"버티브, 차세대 UPS 주도 ··· AI·HPC 고가용성 보장",<b>인공지능</b>(AI) 및 고성능 컴퓨팅(HPC)의 컴퓨팅 및 냉각 요구사항 증가로 인해 전 세계 데이터센터의 전력 수요가 2026년에 2022년 대비 2배 이상 증가할 전망이다. 이에 AI 컴퓨팅을 실행하는 GPU는 물론 CPU의 지속적인... ,https://www.datanet.co.kr/news/articleView.html?idxno=195718,https://www.datanet.co.kr/news/articleView.html?idxno=195718
267,2024-08-13 13:10:00,"밀양시, ‘밀양형 열린 공간 아이키움 배움터, 하반기 프로그램 신청자’ 모집","오는 9월부터 실시하는 하반기 프로그램은 거점 공간인 청소년수련관을 포함한 공공시설과 읍·면 배움터(초등학교 등) 21곳에서 운영되며, △놀이 체육 클래스 △웹툰공작소 △글라스 아트 △<b>인공지능</b> IoT 코딩 △신기한... ",http://www.shinailbo.co.kr/news/articleView.html?idxno=1916844,http://www.shinailbo.co.kr/news/articleView.html?idxno=1916844
268,2024-08-13 13:09:00,"ETRI, 단일 다중감각 인식 장치로 &quot;폐질환 조기 선별&quot;",이 장치는 폐 상태에 대한 정보를 복합적으로 획득한 뒤 <b>인공지능</b> 기술을 통해 다중감각 측정정보와 상호 연관시켜 다각적으로 분석해 다양한 종류의 폐질환을 동시에 선별한다. 연구진은 어려운 폐질환 검사를 사용자의... ,https://www.newsis.com/view/NISX20240813_0002848262,https://n.news.naver.com/mnews/article/003/0012726070?sid=102
269,2024-08-13 13:09:00,상승세 탄 해리스…공화당은 트럼프 막말에 &quot;자제 좀&quot;,"그는 해리스의 유세에 몰린 인파 사진이 <b>인공지능</b>으로 조작됐다거나, 자신의 유세에 참석한 인원이 마틴 루서 킹 목사의 유명 연설보다 많다고 주장했지만 모두 거짓으로 확인됐습니다. 연합뉴스 한미희입니다. #해리스... ",http://www.yonhapnewstv.co.kr/MYH20240813010200032/?input=1825m,https://n.news.naver.com/mnews/article/422/0000676231?sid=104
270,2024-08-13 13:08:00,&quot;국내 가스시장 전망 불일치로 민간·공공 대립 심화&quot;,이와 함께 앞으로 데이터센터와 <b>인공지능</b>(AI) 확대 등에 따른 전력공급 증가에 대응하기 위해 가스가 많은 역할을 해야 한다고 목소리를 높였다. 반도체 클러스터와 데이터센터 등 전력공급 확대에 빠르게 대응할 수... ,https://www.electimes.com/news/articleView.html?idxno=341581,https://www.electimes.com/news/articleView.html?idxno=341581
271,2024-08-13 13:08:00,"공주시, '2024 충남공주시민대학' 2학기 수강생 모집","또, △챗GPT, 더욱 중요해진 좋은 질문의 힘 : 슬기로운 <b>인공지능</b> 생활 △사람과 지역을 기록하다 △꿈 찾기 프로젝트 '뮤지컬' △기후변화 1.5도씨의 미래 △시골집 로망 실현하기 △영화속 인문학 여행 : 시네마톡톡 등... ",https://www.ccdailynews.com/news/articleView.html?idxno=2290920,https://www.ccdailynews.com/news/articleView.html?idxno=2290920
272,2024-08-13 13:06:00,광복절 콘셉트로 AI 사진 찍어요,LG유플러스가 광복절을 맞아 서울 마포구에 위치한 LG유플러스 도화동 공덕역점에서 광복절 콘셉트의 <b>인공지능</b>(AI) 프로필 사진을 제작해주는 ‘익시 포토부스’를 선보였다. 익시 포토부스는 현장에서 촬영한... ,https://www.naeil.com/news/read/519879?ref=naver,https://www.naeil.com/news/read/519879?ref=naver
273,2024-08-13 13:06:00,"중동 국부펀드, 월가에 머니파워 행사","아부다비의 무바달라는 <b>인공지능</b>(AI)과 생명과학, 의료기술 등 새로운 분야나 산업의 문을 여는 데 도움이 되는 투자에 집중하고 있다. 에미리트 관리들은 AI붐으로 엄청난 전력수요가 발생할 것으로 예상하고 있으며... ",https://www.naeil.com/news/read/519875?ref=naver,https://www.naeil.com/news/read/519875?ref=naver
274,2024-08-13 13:06:00,"펫타버스, 시리즈 A 투자 라운드서 100억 원 유치 성공","또한, CES 2023에서 기술혁신상을 수상한 '<b>인공지능</b> 기반 반려동물 신원확인 방법 및 시스템' 기술을 인수하고, 글로벌 등록 특허를 보유하고 있다. 이 기술을 바탕으로 반려동물 데이터 50만 장을 확보하여 PET FACE ID... ",https://www.dt.co.kr/contents.html?article_no=2024081302109923608002&ref=naver,https://n.news.naver.com/mnews/article/029/0002894925?sid=101
275,2024-08-13 13:06:00,"LG전자, <b>인공지능</b>가전 서바이벌 쇼 제작",LG전자가 AI가전의 차별화된 고객경험과 편리함을 알리는 서바이벌 리얼리티쇼를 직접 제작했다. 아마존 산하의 글로벌 온라인동영상서비스(OTT) 프라임비디오에서 선보인다. LG전자는 “현지시간 12일 자체 제작한... ,https://www.naeil.com/news/read/519881?ref=naver,https://www.naeil.com/news/read/519881?ref=naver
276,2024-08-13 13:06:00,"LH, 유지보수서비스 플랫폼 구축","한국토지주택공사(LH)는 메타버스, <b>인공지능</b>(AI) 등 미래기술을 활용해 임대주택 유지보수 서비스를 한층 강화해 나간다고 13일 밝혔다. LH는 올해부터 2026년까지 2단계에 걸쳐 ‘유지보수 서비스 플랫폼’을 구축할... ",https://www.naeil.com/news/read/519889?ref=naver,https://www.naeil.com/news/read/519889?ref=naver
277,2024-08-13 13:06:00,사이클 최적화 ‘갤럭시 워치 울트라’ 체험,전국 18개 트렉 바이시클 직영점에서 별도 예약 없이 참여 가능하다. 챌린지 참여자들은 사이클에 특화된 갤럭시 워치 울트라의 다양한 <b>인공지능</b>(AI) 운동 코칭 기능을 체험할 수 있다. 사진 삼성전자 제공,https://www.naeil.com/news/read/519883?ref=naver,https://www.naeil.com/news/read/519883?ref=naver
278,2024-08-13 13:06:00,"정재욱 충남대병원 교수, 글로벌 의사과학자 양성사업 선정","정 교수는 '오가노이드의 3차원 이미지', '멀티 오믹스 빅데이터'를 <b>인공지능</b>으로 분석해 폐암 오가노이드의 특성 및 상태를 실시간 확인할 수 있게 하는 연구를 수행할 예정이다. 병원은 연구가 폐암 오가노이드의 표준... ",https://www.ggilbo.com/news/articleView.html?idxno=1044519,https://www.ggilbo.com/news/articleView.html?idxno=1044519
279,2024-08-13 13:02:00,"반려동물 스타트업, 대기업과 상생협력",사진 에이아이포펫 제공 2020년 설립된 에이아이포펫은 <b>인공지능</b>(AI) 기반 반려동물 토털 헬스케어 앱 ‘티티케어’(TTcare)를 개발해 운영하고 있다. 티티케어는 사용자가 스마트폰으로 강아지와 고양이 눈이나 피부 치아... ,https://www.naeil.com/news/read/519846?ref=naver,https://www.naeil.com/news/read/519846?ref=naver
280,2024-08-13 13:00:00,서울사이버대 2024학년도 하반기 2차 신/편입생 모집 14일 마감,"기계제어공학과, <b>인공지능</b>학과(개편) ▲ 디자인대학 - 멀티미디어디자인학과, 건축공간디자인학과, 웹문예창작학과, 뷰티디자인학과 ▲ 문화예술대학 - 문화예술경영학과, 실용음악과, 음악치료학과 ▲ 음악대학... ",http://www.veritas-a.com/news/articleView.html?idxno=515930,http://www.veritas-a.com/news/articleView.html?idxno=515930
281,2024-08-13 13:00:00,"LG유플러스, &quot;익시 AI 사진 찍고 광복절 기억하세요&quot;",/사진=LG유플러스 LG유플러스는 광복절을 맞아 서울 마포구에 위치한 LG유플러스 도화동 공덕역점에서 광복절 콘셉트의 <b>인공지능</b>(AI) 프로필 사진을 제작해주는 '익시(ixi) 포토부스'를 선보였다고 13일 밝혔다. 익시... ,https://www.businessplus.kr/news/articleView.html?idxno=67255,https://www.businessplus.kr/news/articleView.html?idxno=67255
282,2024-08-13 13:00:00,"서울 강서구 중장년층, 챗GPT 쉽게 배운다 (B tv 서울뉴스)","스마트폰 세부 기능을 익히는 기초반부터 숏폼 제작, 챗GPT <b>인공지능</b> 앱 활용법 등을 다루는 심화반으로 구성됩니다. 기초반 3개, 심화반 2개로 반별로 20명씩 총 100명이 지원할 수 있습니다. 프로그램은... ",http://ch1.skbroadband.com/content/view?parent_no=24&content_no=57&p_no=172620,http://ch1.skbroadband.com/content/view?parent_no=24&content_no=57&p_no=172620
283,2024-08-13 12:58:00,"가평군, '<b>인공지능</b>' 투명페트병 무인회수기 운영","가평군이 투명페트병 분리배출과 재활용을 높이기 위해 <b>인공지능</b>형 사물인터넷(AIoT) 기술이 도입된 '투명페트병 무인회수기'를 시범 운영하고 있다. 군은 투명페트병 적기 수거, 관리주체 등을 고려해 공공시설인 가평읍... ",https://www.incheonilbo.com/news/articleView.html?idxno=1262078,https://www.incheonilbo.com/news/articleView.html?idxno=1262078
284,2024-08-13 12:56:00,교원 양성 줄이고 '에듀테크 인재' 육성 … 교대·사범대에 49억 투입,"뉴데일리 김성웅 기자 = 교육부가 예비교원의 <b>인공지능</b>(AI) 디지털교과서 수업 역량을 강화하기 전국 교육대학과 초등교육과, 일부 사범대에 전공 자율선택제를 도입하고 '비교원 양성 과정'을 운영하기로 했다. 교육부와... ",https://biz.newdaily.co.kr/site/data/html/2024/08/13/2024081300129.html,https://biz.newdaily.co.kr/site/data/html/2024/08/13/2024081300129.html
285,2024-08-13 12:56:00,"가평군, '<b>인공지능</b>' 투명페트병 무인회수기 운영","가평군은 투명페트병 분리배출 및 재활용을 높이기 위해 <b>인공지능</b>형 사물인터넷(AIoT) 기술이 도입된 '투명페트병 무인회수기'를 지난 8일부터 시범 운영하고 있다고 밝혔다. 가평군은 투명페트병 적기 수거, 관리주체... ",https://www.gukjenews.com/news/articleView.html?idxno=3065633,https://www.gukjenews.com/news/articleView.html?idxno=3065633
286,2024-08-13 12:50:00,"中빅테크 실적 전망...텐센트·핀둬둬 '맑음', 알리 '흐림'","또 광고 플랫폼의 업그레이드, 동영상 서비스인 스핀하오(視頻號) 이용자 증가, <b>인공지능</b>(AI)를 통한 데이터 분석력 증대 등에 힘입어 광고 사업 부문 매출도 17% 늘어났을 것으로 전망했다. 특히 스핀하오는 텐센트가... ",https://www.ajunews.com/view/20240813121108429,https://www.ajunews.com/view/20240813121108429
287,2024-08-13 12:48:00,윤수영 LGD CTO &quot;AI가 OLED 수율 높여줄 것&quot;,이같은 OLED 시대 가속화에는 <b>인공지능</b>(AI)이 동반할 것이란 관측이다. 윤수영 CTO는 이날 행사에서 '디스플레이 산업의 새로운 기회'를 주제로 기조연설을 했다. 올해 3회째를 맞은 이 행사는... ,https://it.chosun.com/news/articleView.html?idxno=2023092121427,https://it.chosun.com/news/articleView.html?idxno=2023092121427
288,2024-08-13 12:46:00,쏟아지는 'AI 모델' 입맛대로 골라 쓰세요...AWS &quot;베드록이 가장 쉬운 방법&quot;,/사진=AWS코리아 제공 세계 최대 클라우드 기업 아마존웹서비스(AWS)가 멀티 거대언어모델(LLM) 전략에 최적화된 '아마존 베드록'을 앞세워 기업용 생성형 <b>인공지능</b>(AI) 시장 확장에 나선다. 13일 서울 역삼동... ,https://www.techm.kr/news/articleView.html?idxno=128723,https://www.techm.kr/news/articleView.html?idxno=128723
289,2024-08-13 12:46:00,과도한 AI 지출 붐에 대한 불안감 '시기상조',사진=로이터연합뉴스 <b>인공지능</b>(AI)에 대한 기업들의 열기가 과도하다는 우려와 함께 이 기술이 기대에 미치지 못할 수도 있다는 우려도 미국 월스트리트를 사로잡고 있다. 그러나 뱅크오브아메리카(BofA)는 이런 우려에... ,https://www.businessplus.kr/news/articleView.html?idxno=67259,https://www.businessplus.kr/news/articleView.html?idxno=67259
290,2024-08-13 12:45:00,"오산시, 진로진학 프로그램 '오산 썸머 유니버스 캠프' 성료","오산시는 입시캠프 외에도 명예의 전당 장학금, 원어민 화상영어 지원, <b>인공지능</b>(AI) 코딩 에듀랩 운영 등 관내 학생들을 대상으로 다양한 학령기별 맞춤 미래인재키움 프로젝트를 진행 중이다.",https://view.asiae.co.kr/article/2024081312451638582,https://n.news.naver.com/mnews/article/277/0005458567?sid=102
291,2024-08-13 12:45:00,[신간] AI 시대 개발자를 위한 핵심 역량... '이것이 취업을 위한 컴퓨터 과학...,오광수 문화전문기자 = AI(<b>인공지능</b>)의 코드 생산성이 이미 인간을 능가하는 시대가 왔다. 프로그래밍 언어의 문법과 프레임워크/라이브러리의 기초 사용법만 알아도 취업이 가능했던 개발자 채용 붐도 끝났다.... ,https://www.newspim.com/news/view/20240813000545,https://www.newspim.com/news/view/20240813000545
292,2024-08-13 12:44:00,"AI의 미래 그리고 리스크, 챗GPT 개발사 최고전략책임자 '제이슨 권'과 비젼 ...","서울시는 AI 스타트업 개발자, <b>인공지능</b>에 관심 있는 대학생, 시민 등이 AI 산업의 인사이트를 자유롭게 교환할 수 있는 '서울 AI 허브 네트워킹 데이' 행사를 이날 오후 4시 <b>인공지능</b>(AI) 분야 기술창업 육성... ",https://www.newscj.com/news/articleView.html?idxno=3168949,https://www.newscj.com/news/articleView.html?idxno=3168949
293,2024-08-13 12:44:00,"공주시, '2024 충남공주시민대학' 2학기 수강생 모집","또 ▲챗GPT, 더욱 중요해진 좋은 질문의 힘 : 슬기로운 <b>인공지능</b> 생활 ▲사람과 지역을 기록하다 ▲꿈 찾기 프로젝트 '뮤지컬' ▲기후변화 1.5도씨의 미래 ▲시골집 로망 실현하기 ▲영화속 인문학 여행 : 시네마톡톡... ",http://www.chungnamilbo.co.kr/news/articleView.html?idxno=785351,http://www.chungnamilbo.co.kr/news/articleView.html?idxno=785351
294,2024-08-13 12:42:00,"시스코, 프라이버시·보안 등 정부가 주도하는 '서울 AI 기업 서약' 동참 선언","삼성전자, KT, 마이크로소프트, 구글, 오픈 AI 등 국내외 <b>인공지능</b>(AI) 관련 기업 14곳이 참여 의사를 밝혔으며, 국제 표준 개발을 위한 협력 강화 지속가능한 AI 발전과 혁신을 위한 시스템 개발 및 투자 전문인력 육성... ",https://www.dailysecu.com/news/articleView.html?idxno=158495,https://www.dailysecu.com/news/articleView.html?idxno=158495
295,2024-08-13 12:42:00,&quot;콘텐츠 인재 여기 모여라&quot; 콘텐츠 유니버스 코리아 콘테스트 개최 [MICE],먼저 크리에이톤은 ‘일상이 콘텐츠다’를 주제로 영상에 포자랩스의 <b>인공지능</b>(AI) 음악을 더한 숏폼 영상(짧은 길이의 영상)을 제작하는 공모전이다. 포자랩스는 누구든 쉽게 음악을 만들 수 있도록 <b>인공지능</b>을... ,http://www.edaily.co.kr/news/newspath.asp?newsid=02604326638986992,https://n.news.naver.com/mnews/article/018/0005810411?sid=101
296,2024-08-13 12:41:00,키 큰 구름부터 부끄럼 많은 구름까지…'구름관찰자를 위한 그림책',"<b>인공지능</b> 시대의 글쓰기에서 마지막까지 기계에 의존할 수 없는 것이 있다면, 그것은 바로 '글쓰기의 감각'이라고 이 책을 말하고 있습니다. --- [불안세대 / 조너선 하이트 / 웅진지식하우스] &quot;소셜 미디어에 5시간 이상... ",https://news.sbs.co.kr/news/endPage.do?news_id=N1007761047&plink=ORI&cooper=NAVER,https://n.news.naver.com/mnews/article/055/0001181164?sid=103
297,2024-08-13 12:40:00,[기고] 지속가능한 데이터센터 위한 효율적인 인프라 운영,효성인포메이션시스템 SA팀 박용진 리더 디지털 전환(Digital Transformation)이 가속화되고 <b>인공지능</b>(AI)이 급격히 확산하면서 데이터센터 수요가 크게 증가하고 있다. 데이터센터는 적지 않은 에너지와 전력을... ,http://www.itdaily.kr/news/articleView.html?idxno=226051,http://www.itdaily.kr/news/articleView.html?idxno=226051
298,2024-08-13 12:40:00,"수원도시재단, '2024 새빛 비즈니스마당' 개최…AI 활용 수출 사례 공유","50대 수출교역국 언어 외국어 명함, 외국어 훈련 등 제공 중소기업인, (예비)창업자, 1인창조기업 등 100명 모집 수원도시재단이 <b>인공지능</b>(AI)에 관심있는 기업인, 창업인들의 해외 수출 성공을 지원하기 위해 나섰다.... ",https://www.kgnews.co.kr/news/article.html?no=805470,https://www.kgnews.co.kr/news/article.html?no=805470
299,2024-08-13 12:38:00,"레인보우로보틱스-현대로템, 육군에 '대테러작전용 다족보행로봇' 시제 납품",이어가 <b>인공지능</b>(AI) 기능을 강화한 '대한민국 육군 맞춤형 대테러로봇'을 양산하는 데 더욱 노력해 나갈 것&quot;이라고 말했다. 한편 레인보우로보틱스는 2022년 6월 '비정형 복잡한 환경에서 매니퓰레이터를 이용한 다중... ,https://www.newscj.com/news/articleView.html?idxno=3168943,https://www.newscj.com/news/articleView.html?idxno=3168943
300,2024-08-13 12:38:00,아이스크림미디어 16일까지 수요예측...청약일정과 상장일,아이스크림미디어 공모주 로고 <b>인공지능</b>(AI)·에듀테크 기업 아이스크림미디어가 코스닥 상장에 도전한다. 허주환 아이스크림미디어 대표이사는 지난 1일 서울 여의도에서 열린 기업설명회에서 &quot;빠르게 변화하는... ,https://www.gukjenews.com/news/articleView.html?idxno=3065523,https://www.gukjenews.com/news/articleView.html?idxno=3065523
