count,date,title,description,org_link,link
498,2024-08-13 11:14:00,"AWS “아마존 베드록, 생성형 AI 모델 최적화 달성”",아마존웹서비스(AWS)가 ‘아마존 베드록’의 생성형 <b>인공지능</b>(AI) 모델을 최적화하고 데이터 연결 성능을 강화했다. AWS는 <b>인공지능</b>(AI) 플랫폼 아마존 베드록에 신규 기능을 도입해 기업의 생성형 AI 애플리케이션 구축을... ,https://news.heraldcorp.com/view.php?ud=20240813050291,https://n.news.naver.com/mnews/article/016/0002349211?sid=105
499,2024-08-13 11:14:00,"하나은행, AI 활용 상업용 부동산 예측 모델 개발…KAIST와 공동 개발",하나은행은 <b>인공지능</b>(AI) 기반 상업용 부동산 시장예측 모델 '하나 AI CRP'를 개발했다고 13일 밝혔다. 이번 서비스는 꾸준히 증가하고 있는 상업용 부동산 투자 상담시 보다 정교하고 차별화된 정보를 제공하기 위해... ,https://www.s-journal.co.kr/news/articleView.html?idxno=23486,https://www.s-journal.co.kr/news/articleView.html?idxno=23486
500,2024-08-13 11:14:00,"'폐질환 조기 선별 시대 열린다'... ETRI, 폐질환 조기 선별기술 선봬",ETRI가 개발한 본 장치는 폐의 상태에 대한 정보를 복합적으로 획득 후 이를 <b>인공지능</b> 기술을 통해 다중감각 측정 정보와 상호 연관시켜 다각적으로 분석해 다양한 종류의 폐질환을 동시에 선별할 수 있다. 기존 폐질환... ,http://www.chungnamilbo.co.kr/news/articleView.html?idxno=785332,http://www.chungnamilbo.co.kr/news/articleView.html?idxno=785332
501,2024-08-13 11:14:00,"미래에셋증권, 마스터스 아카데미 1기 출범식 개최",이번 행사에서는 '마스터스 아카데미' 출범을 기념하여 한국<b>인공지능</b>협회 권영우 부회장의 'ChatGPT를 활용한 기업 경영계획 수립 및 산업 분석'을 주제로 세미나를 실시한다. 또한 2023년 2월부터 진행된 '금융&amp;아트 세미나... ,http://www.handmk.com/news/articleView.html?idxno=24359,http://www.handmk.com/news/articleView.html?idxno=24359
502,2024-08-13 11:14:00,"경기, <b>인공지능</b> 활용 ‘성평등 캠페인 영상’ 공개",결혼‧출산‧양육 주제 제작 시·군 공공기관 등에 배포 경기도는 출생률 저하와 결혼·출산 기피 문제에 대응하기 위해 결혼·출산·양육을 주제로 한 성평등 캠페인 영상을 <b>인공지능</b>(AI) 기술로 제작해 배포한다고 13일... ,https://www.naeil.com/news/read/519920?ref=naver,https://www.naeil.com/news/read/519920?ref=naver
503,2024-08-13 11:14:00,"가평군, 투명페트병 무인회수기 시범운영…관내 공공시설 4곳에 설치",가평군은 관내 공공시설 4곳에 <b>인공지능</b>형 사물인터넷(AIoT) 기술이 도입된 ‘투명페트병 무인회수기’를 설치하고 지난 8일부터 시범 운영에 들어갔다. /가평군 제공가평군이 가평읍 행복누림센터 등 관내 공공시설에... ,http://www.kyeongin.com/main/view.php?key=20240813026487032,http://www.kyeongin.com/main/view.php?key=20240813026487032
504,2024-08-13 11:14:00,"도성훈 인천시교육감 학생들의 새로운 생각, 새로운 도전 돕겠다","‘<b>인공지능</b>과 함께 미리 체험하는 스타트업’ 강의를 진행한 가톨릭대학교 교수는 “꿈이음대학에 참여하는 학생들은 어떤 대학생들보다 적극적이고, 기민하게 학습을 받아들여 매 시간마다 굉장히 놀랐다”며... ",https://www.viva100.com/main/view.php?key=20240813010003514,https://www.viva100.com/main/view.php?key=20240813010003514
505,2024-08-13 11:14:00,"코어라인소프트, 폐색전증 진단보조 AI 'AVIEW PE' 인증 획득","최대 의료 시장인 미국에서도 폐색전증 진단보조 <b>인공지능</b>(AI)소프트웨어가 출시되어 다수의 병원에서 임상적 유효성에 대한 연구들이 발표되고 있는데, 해당 제품은 폐색전증이 의심되는 환자를 의료진에 알려주는... ",https://www.getnews.co.kr/news/articleView.html?idxno=688180,https://www.getnews.co.kr/news/articleView.html?idxno=688180
506,2024-08-13 11:14:00,"하나은행, AI 활용 상업용 부동산 예측 모델 개발…KAIST와 공동 개발",하나은행은 <b>인공지능</b>(AI) 기반 상업용 부동산 시장예측 모델 '하나 AI CRP'를 개발했다고 13일 밝혔다. 이번 서비스는 꾸준히 증가하고 있는 상업용 부동산 투자 상담시 보다 정교하고 차별화된 정보를 제공하기 위해... ,https://www.s-journal.co.kr/news/articleView.html?idxno=23486,https://www.s-journal.co.kr/news/articleView.html?idxno=23486
507,2024-08-13 11:14:00,옥중 순국 87명 수의 벗고 한복 입다…“영웅에 걸맞은 최고의 옷 지었어요”,캠페인은 공훈전자사료관 내 옥중 순국 기록이 있는 독립운동가 중 수형 사진이 마지막 모습으로 남은 87명의 사진에 <b>인공지능</b>(AI) 기술을 통해 한복 명장이 만든 한복을 입히는 것으로 시작했다. 이들 중에는 유관순(2019년... ,https://www.korea.kr/news/policyNewsView.do?newsId=148932558&call_from=naver_news,https://www.korea.kr/news/policyNewsView.do?newsId=148932558&call_from=naver_news
508,2024-08-13 11:13:00,삼성D &quot;AI시대 맞아 새 성장기회…디스플레이산업 주도&quot;,한국디스플레이산업협회 주최 '디스플레이 비즈니스 포럼' 멀티모달 AI·센서통합 디스플레이 등 제시 삼성디스플레이는 <b>인공지능</b>(AI) 시대 디스플레이산업을 주도하기 노력으로 유기발광다이오드(OLED) 재료·소자 개발... ,https://www.yna.co.kr/view/AKR20240813056900003?input=1195m,https://n.news.naver.com/mnews/article/001/0014872317?sid=101
509,2024-08-13 11:13:00,"LGU+, 광복절 콘셉트 ‘AI 포토부스’ 운영",LG유플러스는 광복절을 맞아 서울 마포구에 위치한 LG유플러스 도화동 공덕역점에서 광복절 콘셉트의 <b>인공지능</b>(AI) 프로필 사진을 제작해주는 ‘익시 포토부스’를 선보인다고 13일 밝혔다. 익시 포토부스는 LG유플러스... ,https://news.heraldcorp.com/view.php?ud=20240813050286,https://n.news.naver.com/mnews/article/016/0002349207?sid=105
510,2024-08-13 11:13:00,LG유플러스 &quot;익시 AI 사진으로 광복절 기억하세요&quot;,13일 오전 서울 마포구 LG유플러스 도화동 공덕역점에 마련된 LG유플러스 자체 개발 <b>인공지능</b>(AI) 기술 '익시(ixi)' 포토부스에서 모델들이 광복절 콘셉트의 프로필 사진을 선보이고 있다. 익시 포토부스는 현장에서... ,https://www.hankyung.com/article/202408130172i,https://n.news.naver.com/mnews/article/015/0005021131?sid=102
511,2024-08-13 11:12:00,교통혼잡비용 2배 '껑충'…드론·AI 활용 제주 교통체증 해소 나선다,"드론과 <b>인공지능</b>(AI)을 활용한 첨단 시스템을 통한 제주 교통체증 해소 시도가 이뤄진다. 제주도 자치경찰단은 드론·<b>인공지능</b> 활용 첨단 시뮬레이터 시스템을 도입, 교통정체 해소에 나선다고 13일 밝혔다.... ",https://www.jejudomin.co.kr/news/articleView.html?idxno=303666,https://www.jejudomin.co.kr/news/articleView.html?idxno=303666
512,2024-08-13 11:12:00,이창희 삼성D 부사장 &quot;AI 시대 패널 혁신 선도한다&quot;,"멀티모달 AI란 텍스트, 이미지, 소리 등 다양한 형태의 정보를 동시에 이해하고 처리할 수 있는 <b>인공지능</b>을 말한다. 이 부사장은 &quot;멀티모달 AI는 시선이나 손동작을 추적하고, 이를 토대로 시의적절한 이미지 정보를... ",https://cwn.kr/article/1065578634129305,https://cwn.kr/article/1065578634129305
513,2024-08-13 11:12:00,"유진證, 모트에이아이와 증권업 AI 전환 위해 업무협약 체결","유진투자증권 송경재 전략기획실장은 &quot;<b>인공지능</b>을 활용한 증권 업무의 선진화는 시대적 흐름이다&quot;며 &quot;이번 업무협약을 바탕으로 증권 업무에 AI 도입을 앞당겨 업무의 자동화와 효율성, 그리고 고객 만족도를... ",http://www.hansbiz.co.kr/news/articleView.html?idxno=707443,http://www.hansbiz.co.kr/news/articleView.html?idxno=707443
514,2024-08-13 11:12:00,KT클라우드 데이터센터 운용 효율 높인다,최근 <b>인공지능</b>(AI) 수요가 증가하면서 데이터센터의 효율적인 에너지 관리가 중요해졌다. 이에 KT클라우드는 데이터센터의 에너지 효율화를 위해 저전력·고효율 차세대 냉각기술인 액침냉각의 기술검증을 진행해... ,https://www.ajunews.com/view/20240813110812367,https://www.ajunews.com/view/20240813110812367
515,2024-08-13 11:12:00,CNBC &quot;모건스탠리기 찜한 AI 관련 글로벌 최선호 종목은&quot;,"모건스탠리 홈페이지 월가의 대형 투자은행인 모건스탠리는 유럽종목 가운데 ASML홀딩스(XTR:ASME), SAP(XTR:SAP), 세그로(LNS:SGRO), 머크(XTR:MRK) 등이 <b>인공지능</b>(AI) 매수 리스트에 포함됐다고 밝혔다. 일부 AI 섹터 대표... ",https://news.einfomax.co.kr/news/articleView.html?idxno=4321047,https://news.einfomax.co.kr/news/articleView.html?idxno=4321047
516,2024-08-13 11:11:00,손가락 터치로 혈압 재는 삼성 패널…AI시대 디스플레이도 성장,"멀티모달 AI란 텍스트, 이미지, 소리 등 다양한 형태의 정보를 동시에 이해하고 처리할 수 있는 <b>인공지능</b>을 말합니다. 이 부사장은 &quot;멀티모달 AI는 시선이나 손동작을 추적하고, 이를 토대로 시의적절한 이미지 정보를... ",https://biz.sbs.co.kr/article_hub/20000186754?division=NAVER,https://n.news.naver.com/mnews/article/374/0000397299?sid=101
517,2024-08-13 11:10:00,"“서바이벌 승자, AI 가전 편리함 누린다”…LG전자, 리얼리티쇼 선보여","LG전자가 <b>인공지능</b>(AI) 가전의 차별화된 고객경험과 편리함을 알리는 서바이벌 리얼리티쇼를 제작, 글로벌 OTT에서 선보인다. LG전자는 12일(현지시간) 자체 제작 오리지널 콘텐츠 ‘하우스 오브 서바이벌’을 OTT... ",https://www.kukinews.com/article/view/kuk202408130043,https://www.kukinews.com/article/view/kuk202408130043
518,2024-08-13 11:10:00,"SK하이닉스, 가우스랩스 AI 가상 계측 설루션 식각 공정에 확대",사진=SK하이닉스 SK하이닉스가 투자한 산업용 <b>인공지능</b>(AI) 기업 가우스랩스는 13일 <b>인공지능</b>(AI) 가상 계측 설루션 '파놉테스(Panoptes) VM(Virtual Metrology)' 2.0 버전을 출시했다고 밝혔다. 이 설루션은 반도체 제조... ,http://www.goodkyung.com/news/articleView.html?idxno=244305,http://www.goodkyung.com/news/articleView.html?idxno=244305
519,2024-08-13 11:10:00,"에이블리 남성 패션 앱 4910, 누적 다운로드 수 100만 돌파",4910은 '<b>인공지능</b>(AI) 개인화 추천 기술' 기반 남성 전문 스타일 커머스다. '10세부터 49세까지 폭넓은 남성 패션 취향을 반영한다'라는 의미와 합리적인 가격으로 다양한 상품을 '사고 싶은(4910) 플랫폼'이라는 뜻을... ,https://daily.hankooki.com/news/articleView.html?idxno=1116467,https://daily.hankooki.com/news/articleView.html?idxno=1116467
520,2024-08-13 11:10:00,"남성 패션 플랫폼 4910, 누적 앱 다운로드 수 100만건 돌파","4910은 <b>인공지능</b>(AI) 개인화 추천 기술을 탑재한 남성 전문 패션 앱이다. 10세~49세의 폭넓은 취향을 반영, 사고싶은 플랫폼이란 뜻을 동시에 담고 있다. 7월 기준 4910의 거래액은 3월 대비 110%, 구매고객 수는 130%가... ",https://www.digitaltoday.co.kr/news/articleView.html?idxno=529232,https://www.digitaltoday.co.kr/news/articleView.html?idxno=529232
521,2024-08-13 11:10:00,"[마켓인]블루포인트, 에이블리·미트박스 등 성공 창업가 출신 자문위원단 위...","이번에 위촉된 전문위원들은 <b>인공지능</b>(AI), 유통, 플랫폼, 서비스형 소프트웨어(SaaS) 등 다양한 분야의 스타트업에서 성장의 경험을 보유했다는 특징이 있다. 자문위원단은 현재 5명이 위촉된 상태로, 스타트업의 지원 확대... ",http://www.edaily.co.kr/news/newspath.asp?newsid=02302566638986992,https://n.news.naver.com/mnews/article/018/0005810311?sid=101
522,2024-08-13 11:10:00,"버티브, AI 전력 수요 지원하는 차세대 UPS 솔루션군 공개",<b>인공지능</b>(AI) 및 고성능 컴퓨팅(HPC)의 컴퓨팅 및 냉각 요구사항 증가로 인해 전 세계 데이터센터의 전력 수요가 증가하고 있다. 2026년 전력 수요가 2022년 대비 두 배에 이를 것으로 전망된다. 버티브는 이로 인해... ,https://www.ciokorea.com/news/347309,https://www.ciokorea.com/news/347309
523,2024-08-13 11:10:00,LS일렉트릭 'MSCI 편입' 효과 글로벌 자금 1700억 들어온다,"올해 최고점인 지난달 23일(25만9000원)보다는 떨어진 가격이나 북미를 중심으로 <b>인공지능</b>(AI) 반도체, 데이터센터 투자가 확대되며 글로벌 전력 수요가 증가한 영향에 따른 실적 호조로 증권가에서는 LS일렉트릭의... ",http://www.smedaily.co.kr/news/articleView.html?idxno=300470,http://www.smedaily.co.kr/news/articleView.html?idxno=300470
524,2024-08-13 11:10:00,AI교과서 활용 역량 강화 교원 키운다…일부 대학은 비교원 양성도,대학들이 예비교원의 AI(<b>인공지능</b>) 디지털교과서 활용 역량을 강화하기 위해 교육과정을 개선한다. 일부 사범대는 전공 자율선택제를 도입하고 '비교원 양성 과정'을 운영하기로 했다. 교육부와 한국연구재단은 2024년... ,http://news.mt.co.kr/mtview.php?no=2024081309045348903,https://n.news.naver.com/mnews/article/008/0005076378?sid=102
525,2024-08-13 11:09:00,"LH, `메타버스·AI 활용` 임대주택 유지보수 고도화","한국토지주택공사(LH)는 메타버스, <b>인공지능</b>(AI) 등 미래 기술을 활용해 임대주택 유지보수 서비스를 고도화한다고 13일 밝혔다. 해마다 늘어나는 임대주택 관리물량에 대응하고, 시설 노후화로 급증하는 유지보수 수요를... ",https://www.dt.co.kr/contents.html?article_no=2024081302109963066003&ref=naver,https://n.news.naver.com/mnews/article/029/0002894883?sid=101
526,2024-08-13 11:08:00,"공주시, '2024 충남공주시민대학' 2학기 수강생 모집","또한, ▲챗GPT, 더욱 중요해진 좋은 질문의 힘 : 슬기로운 <b>인공지능</b> 생활 ▲사람과 지역을 기록하다 ▲꿈 찾기 프로젝트 '뮤지컬' ▲기후변화 1.5도씨의 미래 ▲시골집 로망 실현하기 ▲영화속 인문학 여행 : 시네마톡톡... ",http://www.ccnnews.co.kr/news/articleView.html?idxno=343959,http://www.ccnnews.co.kr/news/articleView.html?idxno=343959
527,2024-08-13 11:08:00,"‘가전 라이벌’ 삼성 vs LG전자, 구독사업 놓고 경쟁",삼성전자에서 생활가전을 담당하는 DA 사업부가 최근 <b>인공지능</b>(AI) 관련 가전제품을 출시하면서 LG전자와의 경쟁에서 밀리지 않겠다는 의지인 셈이다. 앞서 임성택 삼성전자 한국총괄 부사장은 지난 4월 ‘비스포크 AI... ,https://www.smartfn.co.kr/article/view/sfn202408130018,https://www.smartfn.co.kr/article/view/sfn202408130018
528,2024-08-13 11:08:00,"K-웹툰, 구글플레이와 손잡고 14억 인도 시장 진출","스토리 작가들이 창작한 스토리를 생성형 <b>인공지능</b>(AI)을 통해 웹툰으로 변환, 이용자들에게 선보일 수 있는 서비스도 제공하고 있다. 서범강 한국웹툰산업협회장은 &quot;이번 파트너십 체결을 통해 글로벌 이용자에게 한 걸음... ",https://www.newsis.com/view/NISX20240813_0002848080,https://n.news.naver.com/mnews/article/003/0012725731?sid=105
529,2024-08-13 11:08:00,'D램' 슈퍼 호황… 삼성 '평택' SK '이천' 증설 박차,AI(<b>인공지능</b>) 수요를 기반으로 HBM(고대역폭메모리) 주문이 폭증한데 이어 서버 시장 회복세가 뚜렷해지면서 범용 D램까지 가격은 고공행진 중이다. 내년 이후 D램 시장이 더 크게 성장할 것이란 기대감까지 더해지면서... ,https://biz.newdaily.co.kr/site/data/html/2024/08/13/2024081300081.html,https://biz.newdaily.co.kr/site/data/html/2024/08/13/2024081300081.html
530,2024-08-13 11:08:00,"LH, 미래기술 활용해 유지보수 서비스 혁신","/LH 한국토지주택공사(LH)는 메타버스, <b>인공지능</b>(AI) 등 미래기술을 활용해 임대주택 유지보수 서비스를 고도화해 나간다고 13일 밝혔다. LH는 해마다 늘어나는 임대주택 관리물량에 대응하고, 시설 노후화로 급증하는... ",http://www.metroseoul.co.kr/article/20240813500161,http://www.metroseoul.co.kr/article/20240813500161
531,2024-08-13 11:08:00,"&quot;다들 미안, 조금만 비켜주세요&quot;...배달 로봇 시대 왔다",배달업계 대표주자 배달의민족과 요기요가 <b>인공지능</b>(AI)을 활용한 푸드테크(FoodTech) 산업에 발걸음을 내디디면서 배민 측이 공개한 로봇의 모습이 귀여움을 자극했기 때문이다. 라이더들의 배달 사고 등 큰 이슈들이... ,http://www.popcornnews.net/news/articleView.html?idxno=64144,http://www.popcornnews.net/news/articleView.html?idxno=64144
532,2024-08-13 11:08:00,"LG전자, 서바이벌 리얼리티쇼 선봬…“AI가전 편리함 알린다”",스마트에프엔 신종모 기자 LG전자가 <b>인공지능</b>(AI)가전의 차별화된 고객경험과 편리함을 알리는 서바이벌 리얼리티쇼를 직접 제작해 아마존 산하의 글로벌 온라인동영상서비스(OTT)인 프라임 비디오에서 선보인다.... ,https://www.smartfn.co.kr/article/view/sfn202408130023,https://www.smartfn.co.kr/article/view/sfn202408130023
533,2024-08-13 11:07:00,HBM 공급부족 전망…증권가 &quot;삼성전자·SK하이닉스 담아라&quot;,글로벌 빅테크 기업들이 <b>인공지능</b>(AI) 데이터센터 구축을 위해 HBM 주문을 큰 폭으로 늘리고 있다는 관측이 나오고 있기 때문이다. 증권업계는 <b>인공지능</b>(AI) 대장주인 엔비디아의 신제품 블랙록 출시와 HBM 용량... ,https://www.newsis.com/view/NISX20240813_0002848084,https://n.news.naver.com/mnews/article/003/0012725728?sid=101
534,2024-08-13 11:06:00,"DB생명, 헬스케어 플랫폼 기업 '디에이블'과 업무제휴 협약 체결","디에이블은 개인의 건강 증진을 위한 'AI(<b>인공지능</b>) 건강 리포트 및 생활습관 케어 콘텐츠'를 제공하는 기업으로, 난임, 임신, 아동 비만 예방 등의 분야에서 솔루션을 운영하고 있다. DB생명은 이번 협력으로 고객... ",http://www.issuenbiz.com/news/articleView.html?idxno=47427,http://www.issuenbiz.com/news/articleView.html?idxno=47427
535,2024-08-13 11:06:00,"네이버가 2대 주주 '사이냅소프트', 네이버AI 연계 서비스 주목 ... NH투증 주...",하이퍼클로바X는 네이버에서 개발한 대규모 생성형 <b>인공지능</b>(AI) 언어 모델(LLM)로 한국어 이해와 구사 능력이 뛰어난 것으로 알려져 있다. 특히 사용자가 입력하는 질문에 대한 답변 생성 이외에도 창작과 요약을... ,http://www.the-stock.kr/news/articleView.html?idxno=20594,http://www.the-stock.kr/news/articleView.html?idxno=20594
536,2024-08-13 11:06:00,"미래에셋증권 WM강남파이낸스센터, 마스터스 아카데미 1기 출범식 개최",이번 행사에서는 마스터스 아카데미 출범을 기념해 한국<b>인공지능</b>협회 권영우 부회장의 ChatGPT를 활용한 기업 경영계획 수립 및 산업 분석을 주제로 세미나를 실시한다. 또 2023년 2월부터 진행된 금융&amp;아트 세미나... ,https://www.onews.tv/news/articleView.html?idxno=215796,https://www.onews.tv/news/articleView.html?idxno=215796
537,2024-08-13 11:04:00,"휴런, 태국 시리라즈 병원과 협력...&quot;<b>인공지능</b> 기반 파킨슨 병 연구할것&quot;",신경 질환 전문 의료 <b>인공지능</b>(AI) 기업 휴런이 태국 시장 개척을 위한 기반을 마련했다. 휴런은 지난 1일 태국 방콕에서 마히돌대학교 시리라즈병원과 연구 협약을 맺었다고 13일 밝혔다. 휴런에 따르면 마히돌대학교의... ,http://www.metroseoul.co.kr/article/20240813500157,http://www.metroseoul.co.kr/article/20240813500157
538,2024-08-13 11:04:00,"세종시, AI 활용 교통상황 예측 시스템 구축한다",세종시는 과학기술정보통신부가 공모한 '차세대 <b>인공지능</b>(AI) 융합' 사업에 선정돼 AI를 활용해 교통 문제 해결에 나선다고 13일 밝혔다. 이 사업은 2024∼2027년 국비 68억2천500만원을 지원받아 다양한 실데이터를 연계한... ,https://www.yna.co.kr/view/AKR20240813064900063?input=1195m,https://n.news.naver.com/mnews/article/001/0014872295?sid=102
539,2024-08-13 11:04:00,"하나은행-KAIST, AI 상업용 부동산 시장예측 모델 협력 개발",하나은행이 <b>인공지능</b>(AI)을 기반으로 국내 시장에 특화된 상업용 부동산 시장예측 모델 '하나 AI CRP(Commercial Real estate market Prediction)' 서비스를 개발했다고 13일 밝혔다. 하나 AI CRP 서비스는 꾸준히 증가하고 있는... ,http://www.efnews.co.kr/news/articleView.html?idxno=113958,http://www.efnews.co.kr/news/articleView.html?idxno=113958
540,2024-08-13 11:04:00,사라진 'AI 거품론',글로벌 증시에 매서운 한파를 불러일으켰던 '<b>인공지능</b>(AI) 거품론'이 한풀 꺼지는 모양새다. 사진/pixabay 글로벌 증시에 매서운 한파를 불러일으켰던 '<b>인공지능</b>(AI) 거품론'이 한풀 꺼지는 모양새다. AI 사업 수익성에... ,http://www.smedaily.co.kr/news/articleView.html?idxno=300465,http://www.smedaily.co.kr/news/articleView.html?idxno=300465
541,2024-08-13 11:04:00,"이창희 삼성디스플레이 연구소장, AI 시대 위한 디스플레이 기술 강조","멀티모달 AI란 텍스트, 이미지, 소리 등 다양한 형태의 정보를 동시에 이해하고 처리할 수 있는 <b>인공지능</b>을 말한다. 이 부사장은 &quot;멀티모달 AI는 시선이나 손동작을 추적하고, 이를 토대로 시의적절한 이미지 정보를... ",http://www.sisacast.kr/news/articleView.html?idxno=59860,http://www.sisacast.kr/news/articleView.html?idxno=59860
542,2024-08-13 11:04:00,"부산·인천서 선보인 던킨 ‘로컬 메뉴’, 한달만에 2만5000개 팔렸다",부산역 앞에 있는 ‘던킨 부산역 라마다점’에서는 AI(<b>인공지능</b>)을 활용해 개발한 지역 특화 메뉴 4종이 인기를 얻었다. ‘광안리 소금우유 크림도넛’은 일반 도넛 대비 약 2배 높은 판매비를 기록하며 매장 1등 제품이... ,https://news.heraldcorp.com/view.php?ud=20240813050264,https://n.news.naver.com/mnews/article/016/0002349192?sid=101
543,2024-08-13 11:04:00,삼일PwC “연말 이후 거시경제 불확실성 개선…M&amp;A 시장 점진적 회복”,기업에서는 인수 자금 마련을 위해 비핵심자산을 매각하고 <b>인공지능</b>(AI)을 중심으로 한 신기술에 투자하려는 수요가 늘고 있다. 보고서는 &quot;풍부한 현금을 보유한 기업이 매출 성장을 가속화하고 혁신을 가능하게 하는... ,https://www.asiatoday.co.kr/view.php?key=20240813010007007,https://www.asiatoday.co.kr/view.php?key=20240813010007007
544,2024-08-13 11:04:00,"휴런, 태국 마히돌대학 시리라즈 병원과 연구 협약 체결","<b>인공지능</b> 기업 휴런(대표 신동훈)은 최근 태국 방콕에서 마히돌대학교 시리라즈 병원과 연구 협약을 맺었다고 밝혔다. 왼쪽부터 휴런 박찬익 부사장, 마히돌대학 Yodchanan Wongsawat 교수, 연구책임자 Pipat Chiewvit... ",http://www.bosa.co.kr/news/articleView.html?idxno=2228999,http://www.bosa.co.kr/news/articleView.html?idxno=2228999
545,2024-08-13 11:04:00,"에이블리 남성 패션 앱 '4910', 누적 다운로드 100만 돌파",'4910(사구일공)'은 '<b>인공지능</b>(AI) 개인화 추천 기술' 기반 남성 전문 스타일 커머스다. '10세부터 49세까지 폭넓은 남성 패션 취향을 반영한다'라는 의미와 합리적인 가격으로 다양한 상품을 '사고 싶은(4910) 플랫폼... ,http://www.smedaily.co.kr/news/articleView.html?idxno=300468,http://www.smedaily.co.kr/news/articleView.html?idxno=300468
546,2024-08-13 11:04:00,"서부발전, 지역인재 요람 '위피스쿨' 14기 수료식 개최",서부발전 직원 4명이 멘티를 대상으로 재능기부인 <b>인공지능</b>·코딩수업을 진행했고 본사 강의실을 열어 지역 학부모와 교사 등 70여명에게 '에듀테크 특강'을 제공하기도 했다. 멘티 학교 관계자는 &quot;초등학교 고학년을... ,http://www.chungnamilbo.co.kr/news/articleView.html?idxno=785296,http://www.chungnamilbo.co.kr/news/articleView.html?idxno=785296
