count,date,title,description,org_link,link
745,2024-08-13 10:22:00,"ACE 미국WideMoat가치주 ETF, 가치주→동일가중으로 이름 변경",또 최근 <b>인공지능</b>(AI) 관련주 등 시가총액 상위 종목 위주로 나타난 쏠림 현상과 조정 과정에서 주가 변동폭이 크게 발생하며 시가총액가중방식에 비해 상대적으로 주가 변동폭이 작은 동일가중방식 상품에... ,https://www.dnews.co.kr/uhtml/view.jsp?idxno=202408131016141460172,https://www.dnews.co.kr/uhtml/view.jsp?idxno=202408131016141460172
746,2024-08-13 10:22:00,"메타버스에 AI 더했다…웅진씽크빅, 영어 스피킹 서비스 ‘링고시티’ 출시",원만호 웅진씽크빅 DX사업본부장은 “메타버스 공간 <b>인공지능</b> 캐릭터와 자유롭게 음성으로 대화하는 제품으로 영어 학습에 거부감이 있는 학생들이 쉽게 접근할 수 있도록 개발됐다”며 “게임하듯 즐기다 보면 나도... ,http://theviewers.co.kr/View.aspx?No=3332071,http://theviewers.co.kr/View.aspx?No=3332071
747,2024-08-13 10:22:00,"삼성전자, 트렉 바이시클과 '울트라 라이딩 챌린지'","챌린지 갤럭시 워치 울트라의 다양한 <b>인공지능</b>(AI) 운동 코칭 기능을 체험할 수 있다. 갤럭시 워치 울트라를 착용하고 약 4분 정도 사이클링을 하면, 1시간 정도 지속 유지할 수 있는 최대 운동 평균 강도 지표인 'FTP... ",http://www.g-enews.com/ko-kr/news/article/news_all/202408130923307915112616b072_1/article.html,http://www.g-enews.com/ko-kr/news/article/news_all/202408130923307915112616b072_1/article.html
748,2024-08-13 10:22:00,무더위 속 12일 전력 총수요 102GW…사상 최대치 경신,"제11차 전력수급기본계획(전기본) 총괄위원회는 지난 5월 11차 전기본 초안을 공개하면서 <b>인공지능</b>(AI) 확산, 반도체 클러스터 조성 등으로 2038년까지 16.7GW의 전력수요 추가요인이 있을 것으로 추정했다.",http://www.seouleconews.com/news/articleView.html?idxno=78946,http://www.seouleconews.com/news/articleView.html?idxno=78946
749,2024-08-13 10:22:00,"LG유플러스, 광복절 맞아 '익시 포토부스' 무료 운영",LG유플러스 모델들이 LG유플러스 도화동 공덕역점에서 광복절 콘셉트 <b>인공지능</b>(AI) 프로필 사진을 제작해주는 '익시 포토부스'를 체험하고 있다. 사진=LG유플러스  LG유플러스가 광복절을 맞아 서울 마포구에 위치한... ,https://weekly.hankooki.com/news/articleView.html?idxno=7093691,https://weekly.hankooki.com/news/articleView.html?idxno=7093691
750,2024-08-13 10:22:00,"NH투자증권, 빅데이터 경진대회 'AI로 미국 ETF를 발견하다' 개최","국내외 대학(원)생을 대상으로 창의적인 아이디어 발굴 및 디지털·<b>인공지능</b>(AI) 인재 조기 확보를 위해 개최했다. NH투자자증권 빅데이터 경진대회는 국내외 대학생과 대학원생이면 누구나 참여 가능하며, 오는 9월... ",https://www.enetnews.co.kr/news/articleView.html?idxno=28047,https://www.enetnews.co.kr/news/articleView.html?idxno=28047
751,2024-08-13 10:22:00,"대전시교육청, 학생 국외과학연구단지 체험프로그램 실시","또한, 실리콘밸리의 Start Up 개척 사례로 PathoBrainSeq의 맞춤형 의약품 개발 현황을, ImpriMed의 항암제 약물 서비스의 <b>인공지능</b> 모델 적용 현황을 알아보고 캘리포니아사이언스센터, 자연사박물관 견학 등... ",http://www.shinailbo.co.kr/news/articleView.html?idxno=1916687,http://www.shinailbo.co.kr/news/articleView.html?idxno=1916687
752,2024-08-13 10:22:00,"하나은행-KAIST, AI 상업용 부동산 시장예측 모델 개발","금리, 물가 등 차별화된 정보 제공 [시장경제=정우교 기자] 사진=하나은행 하나은행은 <b>인공지능</b>(AI)을 기반으로 한 상업용 부동산 시장예측 모델인 '하나AI CRP' 서비스를 개발했다고 13일 밝혔다. 하나AI CRP 서비스는... ",https://www.meconomynews.com/news/articleView.html?idxno=98692,https://www.meconomynews.com/news/articleView.html?idxno=98692
753,2024-08-13 10:21:00,&quot;하반기 거시경제 불확실성 개선되며 M&amp;A 시장 점진적으로 회복할 것&quot;,기업에는 인수자금을 마련하기 위해 비핵심자산을 매각하고 <b>인공지능</b>(AI)을 중심으로 한 신기술에 투자하려는 수요가 늘고 있다. 보고서는 &quot;풍부한 현금을 보유한 기업이 매출 성장을 가속화하고 혁신을 가능케 하는... ,http://www.joseilbo.com/news/news_read.php?uid=523340&class=10&grp=,https://n.news.naver.com/mnews/article/123/0002340258?sid=101
754,2024-08-13 10:21:00,"[에듀플러스]서강대 교수학습센터, K-MOOC 지역사회협력 프로그램 개최",이번 프로그램은 서울시 서부교육지원청 및 숭문고와 협약을 통해 반도체 및 <b>인공지능</b>(AI) 인재 양성을 위한 지역사회협력 프로그램이다. 류성주 교수가 '아두이노를 활용한 전자공학설계 입문'을 주제로 총 9개의... ,https://www.etnews.com/20240813000079,https://n.news.naver.com/mnews/article/030/0003231212?sid=102
755,2024-08-13 10:20:00,에이블리 남성 패션 앱 ‘4910’ 7월 거래액 2배 성장,사구일공(4910)은 '<b>인공지능</b>(AI) 개인화 추천 기술' 기반 남성 전문 스타일 커머스다. 10세부터 49세까지 폭넓은 남성 패션 취향을 반영한다라는 의미와 합리적인 가격으로 다양한 상품을 사고 싶은(4910) 플랫폼이라는... ,https://www.fashionbiz.co.kr/article/209715,https://www.fashionbiz.co.kr/article/209715
756,2024-08-13 10:20:00,"삼성전자, &quot;트렉 최신 자전거타고 갤럭시워치 체험하세요&quot;",또 사이클에 특화된 갤럭시 워치 울트라의 다양한 <b>인공지능</b>(AI) 운동 코칭 기능을 체험할 수 있다. 이번 행사는 전국 18개 트렉 바이시클 직영점에서 별도 예약 없이 참여 가능하다. 챌린지 참여 후 SNS에 참여 후기를... ,https://weekly.hankooki.com/news/articleView.html?idxno=7093688,https://weekly.hankooki.com/news/articleView.html?idxno=7093688
757,2024-08-13 10:20:00,"금천문화재단, 제4회 금천패션영화제 본선 진출작 40편 발표","정다희 감독의 '구독남녀'는 <b>인공지능</b>(AI)을 활용해 제작한 작품으로, <b>인공지능</b>과 패션의 연결 가능성을 제시한다. 대중적으로 친숙한 중견 배우 백일섭, 김금순, 정희태 배우 등이 출연한 작품들도 본선 진출작으로... ",http://www.m-i.kr/news/articleView.html?idxno=1149472,http://www.m-i.kr/news/articleView.html?idxno=1149472
758,2024-08-13 10:20:00,"미래에셋증권, '마스터스 아카데미' 출범",이번 행사에서는 '마스터스 아카데미' 출범을 기념하여 한국<b>인공지능</b>협회 권영우 부회장의 'ChatGPT를 활용한 기업 경영계획 수립 및 산업 분석'을 주제로 세미나를 실시한다. 또한 2023년 2월부터 진행된 '금융&amp;아트... ,https://www.smarttoday.co.kr/news/articleView.html?idxno=57276,https://www.smarttoday.co.kr/news/articleView.html?idxno=57276
759,2024-08-13 10:19:00,"직스테크놀로지, '미래인재 양성' 가천대에 직스캐드 기부",<b>인공지능</b>(AI) 디지털 설계 플랫폼 기업 직스테크놀로지가 지난 12일 미래인재 양성 지원을 위해 가천대에 9억원 상당의 직스캐드(ZYXCAD)를 기부했다. 직스테크놀로지는 기부 협약에 따라 반도체대학 소속 학생뿐 아니라... ,https://www.etnews.com/20240813000075,https://n.news.naver.com/mnews/article/030/0003231208?sid=105
760,2024-08-13 10:18:00,"하나은행, AI 기반 상업용 부동산 예측 모델 '하나AI CRP' 개발",하나은행(은행장 이승열)은 <b>인공지능</b>(AI)을 기반으로 한 상업용 부동산 시장예측 모델인 '하나AI CRP' 서비스를 개발했다고 13일 밝혔다. '하나AI CRP' 서비스는 꾸준히 증가하고 있는 상업용 부동산 투자 상담 시... ,https://www.newspim.com/news/view/20240813000230,https://www.newspim.com/news/view/20240813000230
761,2024-08-13 10:18:00,"유진투자증권-모트에이아이, 증권업 AI 전환 차원 MOU 체결",유진투자증권과 모트에이아이가 증권업 <b>인공지능</b>(AI) 전환을 위한 업무협약(MOU)을 체결했다고 13일 밝혔다. 이번 업무협약은 기존 증권업 시스템과 프로세스에 최적화된 AI 모델 개발을 위한 것이다. 따라서 양사는... ,https://www.financialpost.co.kr/news/articleView.html?idxno=211007,https://www.financialpost.co.kr/news/articleView.html?idxno=211007
762,2024-08-13 10:18:00,중동 긴장·美 CPI 경계감에 코스피 2610선 약보합 [오전 시황],<b>인공지능</b>(AI) 반도체 대표 종목인 엔비디아가 4.08% 오르면서 기술주에 대한 투자 심리는 일부 개선됐다. 국내 증시는 중동 긴장과 미국 물가지표 발표를 앞두고 약세다. 오는 14일 미국 7월... ,https://www.sedaily.com/NewsView/2DD01NLDJT,https://n.news.naver.com/mnews/article/011/0004379572?sid=101
763,2024-08-13 10:18:00,"에이블리 남성 패션앱 4910, 누적 다운로드 수 100만 돌파",4910은 '<b>인공지능</b>(AI) 개인화 추천 기술' 기반 남성 전문 스타일 커머스다. '10세부터 49세까지 폭넓은 남성 패션 취향을 반영한다'라는 의미와 합리적인 가격으로 다양한 상품을 '사고 싶은(4910) 플랫폼'이라는 뜻을... ,https://www.ebn.co.kr/news/view/1633280/?sc=Naver,https://www.ebn.co.kr/news/view/1633280/?sc=Naver
764,2024-08-13 10:18:00,"포스코, 포벤처스 프로그램로 사내 '미래성장벤처' 발굴 순항","고레로보틱스는 건설 현장에서 로봇과 <b>인공지능</b>(AI), BIM 등의 첨단 기술을 접목해 생산성 향상 및 공사기간 단축 솔루션 개발에 주력하고 있으며, 이러한 노력은 국내외 시장에서 호응을 얻으며 기술력을 인정받고... ",http://www.snmnews.com/news/articleView.html?idxno=539310,http://www.snmnews.com/news/articleView.html?idxno=539310
765,2024-08-13 10:18:00,"충남도서관, 로봇 체험·전시 프로그램 운영","충남도서관은 <b>인공지능</b> 로봇 ‘리쿠’ 체험을 비롯해 다양한 로봇 15점을 전시하며, 로봇의 기원이라고 알려진 오토마타 만들기 프로그램도 오는 21일 1∼3학년 초등생을 대상으로 진행할 예정이다. 전시는 운영 기간... ",https://www.viva100.com/main/view.php?key=20240813010003454,https://www.viva100.com/main/view.php?key=20240813010003454
766,2024-08-13 10:18:00,"코어라인소프트, 'AVIEW PE' 의료기기 허가 획득",사진=코어라인소프트  의료 AI(<b>인공지능</b>) 코어라인소프트(대표 김진국)는 최근 AI 솔루션 'AVIEW PE(에이뷰 피이)'에 대한 의료기기 제조인증(시판 전 허가)을 획득했다고 13일 밝혔다. 코어라인소프트 따르면 AVIEW PE(Pulmonary... ,http://www.bizwnews.com/news/articleView.html?idxno=87147,http://www.bizwnews.com/news/articleView.html?idxno=87147
767,2024-08-13 10:18:00,"코어라인소프트, `폐색전증 진단보조 AI 의료기기` 허가 획득",의료 <b>인공지능</b>(AI) 기업 코어라인소프트가 최근 AI 솔루션 'AVIEW PE(에이뷰 피이)'에 대한 의료기기 제조인증을 획득했다고 13일 밝혔다. AVIEW PE는 <b>인공지능</b>을 기반으로 폐색전증을 자동으로 검출하고 진단을 보조하는... ,https://www.dt.co.kr/contents.html?article_no=2024081302109931076001&ref=naver,https://n.news.naver.com/mnews/article/029/0002894847?sid=105
768,2024-08-13 10:17:00,"&quot;AI가전 편리함 알린다&quot;…LG전자, 자체 제작 '서바이벌 리얼리티쇼' 선봬",LG전자가 자사 <b>인공지능</b>(AI)가전의 차별화된 고객경험과 편리함을 알리는 서바이벌 리얼리티쇼를 직접 제작해 아마존 산하의 글로벌 온라인동영상서비스(OTT)인 프라임 비디오에서 선보인다. LG전자는 12일(현지시간)... ,http://www.inews24.com/view/1752443,https://n.news.naver.com/mnews/article/031/0000861512?sid=101
769,2024-08-13 10:16:00,미래에셋증권 WM강남파이낸스센터 '마스터스 아카데미 1기' 출범,이번 행사에서는 '마스터스 아카데미' 출범을 기념하여 한국<b>인공지능</b>협회 권영우 부회장의 'ChatGPT를 활용한 기업 경영계획 수립 및 산업 분석'을 주제로 세미나를 실시한다. 또한 2023년 2월부터 진행된 '금융&amp;아트 세미나... ,https://www.businesskorea.co.kr/news/articleView.html?idxno=222927,https://www.businesskorea.co.kr/news/articleView.html?idxno=222927
770,2024-08-13 10:16:00,"AWS “아마존 베드록, 생성형 AI 모델 최적화 달성”",아마존웹서비스(AWS)가 ‘아마존 베드록’의 생성형 <b>인공지능</b>(AI) 모델을 최적화하고 데이터 연결 성능을 강화했다. AWS는 AI 플랫폼 아마존 베드록에 신규 기능을 도입해 기업들의 생성형 AI 애플리케이션 구축을... ,https://news.heraldcorp.com/view.php?ud=20240813050202,https://n.news.naver.com/mnews/article/016/0002349139?sid=105
771,2024-08-13 10:16:00,일본 '방위이노베이션기술연구소' 10월 개설…혁신 신무기 개발,"방위성은 새 연구소가 <b>인공지능</b>(AI), 로봇, 소립자 등 분야의 전문가를 기용해 신기술을 개발하거나 기존 기술을 응용해 새로운 방위 장비를 만들도록 할 계획이다. 또 방위장비청의 하부 조직으로, 국제적인 기술... ",https://www.yna.co.kr/view/AKR20240813050600073?input=1195m,https://n.news.naver.com/mnews/article/001/0014872116?sid=104
772,2024-08-13 10:16:00,가우스랩스 &quot;AI가 반도체 공정 결과 예측&quot;…'파놉테스 VM 2.0' 출시,우먼타임스 = 심은혜 기자 SK하이닉스의 산업용 <b>인공지능</b>(AI) 전문 자회사 가우스랩스는 AI 기반 가상 계측 솔루션 '파놉테스 VM(Virtual Metrology)'의 2.0 버전을 출시했다고 13일 밝혔다. 파놉테스 VM은 장비에 설치된... ,http://www.womentimes.co.kr/news/articleView.html?idxno=78192,http://www.womentimes.co.kr/news/articleView.html?idxno=78192
773,2024-08-13 10:16:00,"코어라인소프트, AI 솔루션 ‘AVIEW PE’ 의료기기 제조인증 획득","김정아 기자 | 의료 <b>인공지능</b>(AI) 기업 코어라인소프트(김진국)가 최근 AI 솔루션 ‘AVIEW PE(에이뷰 피이)’에 대한 의료기기 제조인증(시판 전 허가)을 획득했다고 13일 밝혔다. AVIEW PE(Pulmonary Embolism, PE)는 AI를 기반으로... ",http://digitalchosun.dizzo.com/site/data/html_dir/2024/08/13/2024081380060.html,http://digitalchosun.dizzo.com/site/data/html_dir/2024/08/13/2024081380060.html
774,2024-08-13 10:16:00,코스콤 '코리아 핀테크 위크' 참가…금융업 AI 도입 방향 제시,코스콤은 오는 27일부터 사흘 간 서울 동대문 디자인 플라자(DDP)에서 진행되는 '코리아 핀테크 위크 2024' 행사에 참가해 '금융업계 AI서비스 도입 전략'을 주제로 한 세미나·홍보관을 열고 <b>인공지능</b>(AI) 서비스 도입... ,https://www.widedaily.com/news/articleView.html?idxno=242330,https://www.widedaily.com/news/articleView.html?idxno=242330
775,2024-08-13 10:16:00,"하나은행-KAIST, AI 활용 상업용 부동산 예측 모델 개발...하반기부터 영업점...",이은정 하나은행 WM본부 본부장과 김우창 KAIST 교수 등 관계자들이 기념촬영을 하고 있다/사진=하나은행 하나은행은 <b>인공지능</b>(AI)을 기반으로 한 상업용 부동산 시장예측 모델인 '하나AI CRP' 서비스를 개발했다고 13일... ,http://www.issuenbiz.com/news/articleView.html?idxno=47424,http://www.issuenbiz.com/news/articleView.html?idxno=47424
776,2024-08-13 10:15:00,광복군 나라사랑 태극기 배경으로 AI 프로필 사진 찍어볼까,LG유플러스는 광복절을 맞아 서울 마포구 도화동 LG유플러스 공덕역점에 선보인 ‘익시 포토부스’에서 국가등록문화재 제389호로 지정된 한국광복군 서명문 태극기를 배경으로 <b>인공지능</b>(AI) 프로필 사진을 찍을 수... ,https://www.khan.co.kr/economy/economy-general/article/202408131014001,https://n.news.naver.com/mnews/article/032/0003314603?sid=101
777,2024-08-13 10:15:00,"유진證, 모트에이아이와 증권업 AI 전환 업무협약 체결","송경재 유진투자증권 전략기획실장은 &quot;<b>인공지능</b>을 활용한 증권 업무의 선진화는 시대적 흐름&quot;이라며 &quot;이번 업무협약을 바탕으로 증권 업무에 AI 도입을 앞당겨 업무의 자동화와 효율성, 그리고 고객... ",http://www.seoulfn.com/news/articleView.html?idxno=529335,http://www.seoulfn.com/news/articleView.html?idxno=529335
778,2024-08-13 10:14:00,"[특징주]&quot;구조적 성장기반&quot; 아이티엠반도체, 7.65%↑",보호회로는 방열과 부피 절감에 기여할 수 있는 부품으로 기기 내장형 <b>인공지능</b>(온디바이스 AI) 시대에 수요가 증가하는 추세&quot;라고 설명했다. 그러면서 &quot;PMP 제품은 기술력을 인정받아 2019년 북미의 글로벌 고객사의... ,https://view.asiae.co.kr/article/2024081310144177894,https://n.news.naver.com/mnews/article/277/0005458439?sid=101
779,2024-08-13 10:14:00,[13일 충남도] 토지대장 한글화 디지털 구축 사업 연내 마무리 등,"먼저, 게임 배경음악(OST) 오케스트라 ‘플래직’ , 남자 아이돌그룹 ‘엔카이브’의 공연이 진행되고, <b>인공지능</b>(AI) 놀이터, 아케이드 게임, 코스프레 포토존, 과학 교육, 두뇌 게임, 만들기 체험 등 40여 개의 체험 부스를... ",https://www.asiatime.co.kr/article/20240813500089,https://www.asiatime.co.kr/article/20240813500089
780,2024-08-13 10:14:00,"&quot;AI 사이클링 코칭 체험&quot;...삼성전자, 트렉 바이시클과 '울트라 라이딩 챌린지...",/사진=삼성전자   AI(<b>인공지능</b>) 운동 코칭 기능을 갖춘 '갤럭시 워치 울트라'로 삼성전자가 특별한 사이클링 경험을 제공한다. 삼성전자는 '트렉 바이시클'과 함께 사이클 운동에 최적화된 '갤럭시 워치 울트라'를... ,http://www.4th.kr/news/articleView.html?idxno=2067644,http://www.4th.kr/news/articleView.html?idxno=2067644
781,2024-08-13 10:13:00,"롯데아울렛 이시아폴리스점, 어린이 AI챌린지 25일까지 개최",롯데아울렛 이시아폴리스점은 '제2회 AI(<b>인공지능</b>) 모션 스토리텔러 챌린지'를 개최한다고 13일 밝혔다. 오는 17일부터 25일까지 초등학교 저학년부(1~3학년)와 고학년부(4~6학년)로 나눠 4차례 진행되는 이 대회는 각... ,https://www.news1.kr/local/daegu-gyeongbuk/5509249,https://n.news.naver.com/mnews/article/421/0007727131?sid=102
782,2024-08-13 10:12:00,"국립목포해양대학교, '2024년도 글로벌 기초연구실 지원사업' 선정","이영철 교수는 “에너지 하베스터와 <b>인공지능</b>(AI)을 기반으로 자율운항 선박의 완전 자율화를 위한 핵심 기술을 확보하는 것이 최우선 목표”라며 “위성통신을 기반으로 하는 도심항공교통(UAM), 자율운항 선박과 같은... ",https://www.etnews.com/20240813000068,https://n.news.naver.com/mnews/article/030/0003231201?sid=102
783,2024-08-13 10:12:00,"LH, 메타버스·AI 활용 임대주택 유지보수 서비스 혁신","/한국토지주택공사(LH) 제공 한국토지주택공사(LH)가 13일 메타버스, <b>인공지능</b>(AI) 등 미래기술을 활용해 임대주택 유지보수 서비스를 고도화한다고 밝혔다. LH는 이날 &quot;해마다 늘어나는 임대주택 관리물량에 대응하고... ",http://www.hansbiz.co.kr/news/articleView.html?idxno=707455,http://www.hansbiz.co.kr/news/articleView.html?idxno=707455
784,2024-08-13 10:12:00,"미래에셋증권 WM강남파이낸스센터, '마스터스 아카데미 1기' 출범 기념 행사 ...",이번 행사에서는 '마스터스 아카데미' 출범을 기념해 한국<b>인공지능</b>협회 권영우 부회장의 'ChatGPT를 활용한 기업 경영계획 수립 및 산업 분석'을 주제로 세미나를 실시한다. 또한 지난해 2월부터 진행된 '금융&amp;아트 세미나... ,https://www.businessplus.kr/news/articleView.html?idxno=67207,https://www.businessplus.kr/news/articleView.html?idxno=67207
785,2024-08-13 10:12:00,"코스콤, '코리아 핀테크 위크 2024' 개최...금융업 AI 도입 향방 제시",/코스콤 코스콤이 세미나를 열고 <b>인공지능</b>(AI) 서비스 도입 및 발전 방향을 공유한다. 코스콤은 이달 27일부터 3일간 동대문 디자인 플라자(DDP) 에서 진행되는 '코리아 핀테크 위크 2024' 행사에서 '금융업계 AI서비스 도입... ,http://www.metroseoul.co.kr/article/20240813500109,http://www.metroseoul.co.kr/article/20240813500109
786,2024-08-13 10:12:00,"오픈AI 제이슨 권 CSO, 서울 AI 허브서 미래 비전 공유","서울시는 오후 4시 <b>인공지능</b> 분야 기술창업 육성 전문기관인 서울 AI 허브에서 '네트워킹 데이' 행사를 열며, 제이슨 권을 비롯해 박찬진 서울 AI 허브 센터장, 김앤장 법률사무소의 AI 전문가들이 연사로 나섭니다.... ",https://www.obsnews.co.kr/news/articleView.html?idxno=1451929,https://www.obsnews.co.kr/news/articleView.html?idxno=1451929
787,2024-08-13 10:12:00,"하나은행, AI로 상업용 부동산시장 예측한다",|스마트투데이=김국헌 기자| 하나은행은 AI(<b>인공지능</b>)를 기반으로 한 상업용 부동산 시장예측 모델인 '하나AI CRP' 서비스를 개발했다고 13일 밝혔다. 하나은행은 꾸준히 증가하는 상업용 부동산 투자에 더 정교하고... ,https://www.smarttoday.co.kr/news/articleView.html?idxno=57278,https://www.smarttoday.co.kr/news/articleView.html?idxno=57278
788,2024-08-13 10:12:00,"미래에셋증권 WM강남파이낸스센터, '마스터스 아카데미 1기' 출범식 개최",이번 행사에서는 '마스터스 아카데미' 출범을 기념해 한국<b>인공지능</b>협회 권영우 부회장의 'ChatGPT를 활용한 기업 경영계획 수립 및 산업 분석'을 주제로 세미나를 실시한다. 또한 2023년 2월부터 진행된 '금융&amp;아트 세미나... ,https://www.meconomynews.com/news/articleView.html?idxno=98695,https://www.meconomynews.com/news/articleView.html?idxno=98695
789,2024-08-13 10:12:00,유지보수 서비스 플랫폼 구축...LH &quot;메타버스 등 미래기술 활용&quot;,"13일 LH는 메타버스, <b>인공지능</b>(AI) 등 미래기술을 활용해 임대주택 유지보수 서비스를 고도화해 나간다고 밝혔다. 이는 1월 발표된 정부 국정과제인 '스마트 기술을 활용한 양질의 주거복지 실현'에 따라 위해 추진되는... ",http://www.4th.kr/news/articleView.html?idxno=2067652,http://www.4th.kr/news/articleView.html?idxno=2067652
790,2024-08-13 10:10:00,"[위클리오늘] 미래에셋증권 WM강남파이낸스센터, '마스터스 아카데미 1기' 출...",이번 행사에서는 '마스터스 아카데미' 출범을 기념해 한국<b>인공지능</b>협회 권영우 부회장의 'ChatGPT를 활용한 기업 경영계획 수립 및 산업 분석'을 주제로 세미나를 실시한다. 더불어 지난해 2월부터 진행된 '금융&amp;아트... ,http://www.weeklytoday.com/news/articleView.html?idxno=644626,http://www.weeklytoday.com/news/articleView.html?idxno=644626
791,2024-08-13 10:10:00,"LG전자, 서바이벌 리얼리티쇼 직접 만들어 AI가전 알린다",LG전자가 LG <b>인공지능</b>(AI) 가전의 차별화된 고객경험과 편리함을 알리는 서바이벌 리얼리티쇼를 직접 제작해 글로벌 온라인동영상서비스(OTT) 프라임 비디오에서 선보인다. LG전자는 12일(현지시간) 자사가 자체 제작한... ,https://www.womennews.co.kr/news/articleView.html?idxno=250895,https://n.news.naver.com/mnews/article/310/0000118170?sid=101
792,2024-08-13 10:10:00,"미래에셋증권, '마스터스 아카데미 1기' 출범 기념 행사",이번 행사에서는 '마스터스 아카데미' 출범을 기념하여 한국<b>인공지능</b>협회 권영우 부회장의 'ChatGPT를 활용한 기업 경영계획 수립 및 산업 분석'을 주제로 세미나를 실시한다. 또 2023년 2월부터 진행된 '금융&amp;아트 세미나... ,http://www.m-i.kr/news/articleView.html?idxno=1149467,http://www.m-i.kr/news/articleView.html?idxno=1149467
793,2024-08-13 10:10:00,"알피바이오, MZ세대 소통 위한 '생성형 AI' 콘텐츠 공개",일 경험 사업 ESG팀의 AI 기술을 활용한 웹툰 숏폼(사진=알피바이오) 알피바이오(314140)가 MZ세대 지원 국책사업인 '일 경험 청년' 협업을 통해 생성형 <b>인공지능</b>(AI) 기술을 적용한 기업 홍보 콘텐츠를 공개했다고 13일... ,http://www.biotimes.co.kr/news/articleView.html?idxno=16580,http://www.biotimes.co.kr/news/articleView.html?idxno=16580
